{
  "$schema": "https://json-schema.org/draft/2020-12/schema",
  "$id": "https://converact.invalid/schemas/goal-03-evidence-index-v1.schema.json",
  "type": "object",
  "additionalProperties": false,
  "required": [
    "$schema",
    "evidence_index_id",
    "version",
    "generated_at",
    "binding",
    "current_state",
    "production_eligible",
    "entries",
    "inherited_claims",
    "external_or_environment_blockers"
  ],
  "properties": {
    "$schema": {
      "const": "./evidence-index-v1.schema.json"
    },
    "evidence_index_id": {
      "const": "converact-goal-03-evidence-index-v1"
    },
    "version": {
      "const": "1.0.0"
    },
    "generated_at": {
      "type": "string",
      "format": "date-time"
    },
    "binding": {
      "type": "object",
      "additionalProperties": false,
      "required": [
        "goal_path",
        "goal_sha256",
        "amendment_path",
        "amendment_sha256",
        "manifest_path",
        "manifest_sha256",
        "g02_development_gate_commit",
        "gate_split_commit"
      ],
      "properties": {
        "goal_path": {
          "const": "goals/goal-03-sip-call-durable-foundation.md"
        },
        "goal_sha256": {
          "const": "05ce7f940782ab0efcd013d413220d068a7d3be1bab981f2c2c4f6a6f2a217af"
        },
        "amendment_path": {
          "const": "goals/amendments/2026-08-02-g02-g03-gate-split-v1.json"
        },
        "amendment_sha256": {
          "const": "3f55c9afdc2af68d8a93a5cfe19311cb9aaefb63192c85475d479af98fa2049b"
        },
        "manifest_path": {
          "const": "goals/manifest.json"
        },
        "manifest_sha256": {
          "const": "11b026b5014dc344d4e5b2459aafc0b251190075a212fc68f40dce62fbbda912"
        },
        "g02_development_gate_commit": {
          "const": "16ab4af98c5f3b453ad3d9bdd1ae5fe959a37720"
        },
        "gate_split_commit": {
          "const": "e5f4c81e8eb796131313aab8f5b3a47231fe41b7"
        }
      }
    },
    "current_state": {
      "enum": [
        "implementation_in_progress",
        "completed",
        "blocked_external"
      ]
    },
    "production_eligible": {
      "const": false
    },
    "entries": {
      "type": "array",
      "minItems": 15,
      "maxItems": 15,
      "items": {
        "type": "object",
        "additionalProperties": false,
        "required": [
          "evidence_id",
          "claim",
          "status",
          "evidence_uris",
          "source_commit",
          "raw_output_sha256",
          "production_eligible"
        ],
        "properties": {
          "evidence_id": {
            "type": "string",
            "pattern": "^G03-E[0-9]{2}-[A-Z0-9-]+$"
          },
          "claim": {
            "type": "string",
            "minLength": 1
          },
          "status": {
            "enum": [
              "not_run",
              "verified_source",
              "verified_local",
              "verified_controlled",
              "blocked_external",
              "failed"
            ]
          },
          "evidence_uris": {
            "type": "array",
            "uniqueItems": true,
            "items": {
              "type": "string",
              "minLength": 1
            }
          },
          "source_commit": {
            "anyOf": [
              {
                "type": "null"
              },
              {
                "type": "string",
                "pattern": "^[a-f0-9]{40}$"
              }
            ]
          },
          "raw_output_sha256": {
            "anyOf": [
              {
                "type": "null"
              },
              {
                "type": "string",
                "pattern": "^[a-f0-9]{64}$"
              }
            ]
          },
          "production_eligible": {
            "const": false
          }
        }
      }
    },
    "inherited_claims": {
      "type": "array",
      "maxItems": 0
    },
    "external_or_environment_blockers": {
      "type": "array",
      "uniqueItems": true,
      "items": {
        "type": "string",
        "minLength": 1
      }
    }
  }
}
